[
  {
    "id": "abc-news",
    "name": "ABC News",
    "url": "https://abcnews.go.com",
    "type": "media",
    "type_tags": [
      "新闻媒体"
    ],
    "task_tags": [
      "fast_alert",
      "verification"
    ],
    "coverage_topics": [
      "world",
      "geopolitics"
    ],
    "region": "global",
    "language": "multi",
    "reliability_score": 0.75,
    "signal_to_noise": 0.68,
    "update_frequency": "daily",
    "bias_profile": "mixed/unknown",
    "agent_use_cases": [
      "fact_crosscheck",
      "background_monitoring"
    ],
    "active": true,
    "notes": ""
  },
  {
    "id": "abc-news-australia",
    "name": "ABC News Australia",
    "url": "https://abc.net.au/news",
    "type": "media",
    "type_tags": [
      "新闻媒体"
    ],
    "task_tags": [
      "fast_alert",
      "verification"
    ],
    "coverage_topics": [
      "world",
      "geopolitics"
    ],
    "region": "global",
    "language": "multi",
    "reliability_score": 0.75,
    "signal_to_noise": 0.68,
    "update_frequency": "daily",
    "bias_profile": "mixed/unknown",
    "agent_use_cases": [
      "fact_crosscheck",
      "background_monitoring"
    ],
    "active": true,
    "notes": ""
  },
  {
    "id": "aei",
    "name": "AEI",
    "url": "https://www.aei.org",
    "type": "thinktank",
    "type_tags": [
      "智库"
    ],
    "task_tags": [
      "verification",
      "background"
    ],
    "coverage_topics": [
      "world",
      "geopolitics"
    ],
    "region": "global",
    "language": "multi",
    "reliability_score": 0.78,
    "signal_to_noise": 0.68,
    "update_frequency": "daily",
    "bias_profile": "mixed/unknown",
    "agent_use_cases": [
      "fact_crosscheck",
      "background_monitoring"
    ],
    "active": true,
    "notes": ""
  },
  {
    "id": "ai-news",
    "name": "AI News",
    "url": "https://www.artificialintelligence-news.com",
    "type": "media",
    "type_tags": [
      "AI科技媒体"
    ],
    "task_tags": [
      "fast_alert",
      "verification"
    ],
    "coverage_topics": [
      "technology",
      "ai"
    ],
    "region": "global",
    "language": "multi",
    "reliability_score": 0.75,
    "signal_to_noise": 0.68,
    "update_frequency": "daily",
    "bias_profile": "mixed/unknown",
    "agent_use_cases": [
      "fact_crosscheck",
      "background_monitoring"
    ],
    "active": true,
    "notes": ""
  },
  {
    "id": "al-jazeera",
    "name": "Al Jazeera",
    "url": "https://www.aljazeera.com",
    "type": "media",
    "type_tags": [
      "综合新闻媒体"
    ],
    "task_tags": [
      "fast_alert",
      "verification"
    ],
    "coverage_topics": [
      "world",
      "geopolitics"
    ],
    "region": "global",
    "language": "multi",
    "reliability_score": 0.75,
    "signal_to_noise": 0.68,
    "update_frequency": "daily",
    "bias_profile": "mixed/unknown",
    "agent_use_cases": [
      "fact_crosscheck",
      "background_monitoring"
    ],
    "active": true,
    "notes": ""
  },
  {
    "id": "ap-mexico",
    "name": "AP Mexico",
    "url": "https://apnews.com/hub/latin-america",
    "type": "media",
    "type_tags": [
      "通讯社地区分发"
    ],
    "task_tags": [
      "fast_alert",
      "verification"
    ],
    "coverage_topics": [
      "world",
      "geopolitics"
    ],
    "region": "global",
    "language": "multi",
    "reliability_score": 0.86,
    "signal_to_noise": 0.68,
    "update_frequency": "daily",
    "bias_profile": "mixed/unknown",
    "agent_use_cases": [
      "fact_crosscheck",
      "background_monitoring"
    ],
    "active": true,
    "notes": ""
  },
  {
    "id": "ap-news",
    "name": "AP News",
    "url": "https://apnews.com",
    "type": "media",
    "type_tags": [
      "通讯社"
    ],
    "task_tags": [
      "fast_alert",
      "verification"
    ],
    "coverage_topics": [
      "world",
      "geopolitics"
    ],
    "region": "global",
    "language": "multi",
    "reliability_score": 0.86,
    "signal_to_noise": 0.68,
    "update_frequency": "daily",
    "bias_profile": "mixed/unknown",
    "agent_use_cases": [
      "fact_crosscheck",
      "background_monitoring"
    ],
    "active": true,
    "notes": ""
  },
  {
    "id": "arab-news",
    "name": "Arab News",
    "url": "https://www.arabnews.com",
    "type": "media",
    "type_tags": [
      "新闻媒体"
    ],
    "task_tags": [
      "fast_alert",
      "verification"
    ],
    "coverage_topics": [
      "world",
      "geopolitics"
    ],
    "region": "global",
    "language": "multi",
    "reliability_score": 0.75,
    "signal_to_noise": 0.68,
    "update_frequency": "daily",
    "bias_profile": "mixed/unknown",
    "agent_use_cases": [
      "fact_crosscheck",
      "background_monitoring"
    ],
    "active": true,
    "notes": ""
  },
  {
    "id": "arms-control-assn",
    "name": "Arms Control Assn",
    "url": "https://www.armscontrol.org",
    "type": "thinktank",
    "type_tags": [
      "智库/军控"
    ],
    "task_tags": [
      "verification",
      "background"
    ],
    "coverage_topics": [
      "world",
      "geopolitics"
    ],
    "region": "global",
    "language": "multi",
    "reliability_score": 0.78,
    "signal_to_noise": 0.68,
    "update_frequency": "daily",
    "bias_profile": "mixed/unknown",
    "agent_use_cases": [
      "fact_crosscheck",
      "background_monitoring"
    ],
    "active": true,
    "notes": ""
  },
  {
    "id": "ars-technica",
    "name": "Ars Technica",
    "url": "https://arstechnica.com",
    "type": "media",
    "type_tags": [
      "科技媒体"
    ],
    "task_tags": [
      "fast_alert",
      "verification"
    ],
    "coverage_topics": [
      "technology",
      "ai"
    ],
    "region": "global",
    "language": "multi",
    "reliability_score": 0.75,
    "signal_to_noise": 0.68,
    "update_frequency": "daily",
    "bias_profile": "mixed/unknown",
    "agent_use_cases": [
      "fact_crosscheck",
      "background_monitoring"
    ],
    "active": true,
    "notes": ""
  },
  {
    "id": "arxiv-ai",
    "name": "ArXiv AI",
    "url": "https://arxiv.org",
    "type": "research",
    "type_tags": [
      "学术论文源"
    ],
    "task_tags": [
      "verification",
      "background"
    ],
    "coverage_topics": [
      "world",
      "geopolitics"
    ],
    "region": "global",
    "language": "multi",
    "reliability_score": 0.75,
    "signal_to_noise": 0.68,
    "update_frequency": "daily",
    "bias_profile": "mixed/unknown",
    "agent_use_cases": [
      "fact_crosscheck",
      "background_monitoring"
    ],
    "active": true,
    "notes": ""
  },
  {
    "id": "asahi-shimbun",
    "name": "Asahi Shimbun",
    "url": "https://www.asahi.com",
    "type": "media",
    "type_tags": [
      "地区新闻媒体"
    ],
    "task_tags": [
      "fast_alert",
      "verification"
    ],
    "coverage_topics": [
      "world",
      "geopolitics"
    ],
    "region": "global",
    "language": "multi",
    "reliability_score": 0.75,
    "signal_to_noise": 0.68,
    "update_frequency": "daily",
    "bias_profile": "mixed/unknown",
    "agent_use_cases": [
      "fact_crosscheck",
      "background_monitoring"
    ],
    "active": true,
    "notes": ""
  },
  {
    "id": "asharq-business",
    "name": "Asharq Business",
    "url": "https://asharqbusiness.com",
    "type": "media",
    "type_tags": [
      "财经媒体"
    ],
    "task_tags": [
      "fast_alert",
      "verification"
    ],
    "coverage_topics": [
      "finance",
      "economy"
    ],
    "region": "global",
    "language": "multi",
    "reliability_score": 0.75,
    "signal_to_noise": 0.68,
    "update_frequency": "daily",
    "bias_profile": "mixed/unknown",
    "agent_use_cases": [
      "fact_crosscheck",
      "background_monitoring"
    ],
    "active": true,
    "notes": ""
  },
  {
    "id": "atlantic-council",
    "name": "Atlantic Council",
    "url": "https://www.atlanticcouncil.org",
    "type": "thinktank",
    "type_tags": [
      "智库"
    ],
    "task_tags": [
      "verification",
      "background"
    ],
    "coverage_topics": [
      "world",
      "geopolitics"
    ],
    "region": "global",
    "language": "multi",
    "reliability_score": 0.78,
    "signal_to_noise": 0.68,
    "update_frequency": "daily",
    "bias_profile": "mixed/unknown",
    "agent_use_cases": [
      "fact_crosscheck",
      "background_monitoring"
    ],
    "active": true,
    "notes": ""
  },
  {
    "id": "axios",
    "name": "Axios",
    "url": "https://www.axios.com",
    "type": "media",
    "type_tags": [
      "综合新闻媒体"
    ],
    "task_tags": [
      "fast_alert",
      "verification"
    ],
    "coverage_topics": [
      "world",
      "geopolitics"
    ],
    "region": "global",
    "language": "multi",
    "reliability_score": 0.75,
    "signal_to_noise": 0.68,
    "update_frequency": "daily",
    "bias_profile": "mixed/unknown",
    "agent_use_cases": [
      "fact_crosscheck",
      "background_monitoring"
    ],
    "active": true,
    "notes": ""
  },
  {
    "id": "bangkok-post",
    "name": "Bangkok Post",
    "url": "https://www.bangkokpost.com",
    "type": "media",
    "type_tags": [
      "地区新闻媒体"
    ],
    "task_tags": [
      "fast_alert",
      "verification"
    ],
    "coverage_topics": [
      "world",
      "geopolitics"
    ],
    "region": "global",
    "language": "multi",
    "reliability_score": 0.75,
    "signal_to_noise": 0.68,
    "update_frequency": "daily",
    "bias_profile": "mixed/unknown",
    "agent_use_cases": [
      "fact_crosscheck",
      "background_monitoring"
    ],
    "active": true,
    "notes": ""
  },
  {
    "id": "bbc-africa",
    "name": "BBC Africa",
    "url": "https://www.bbc.com/news/world/africa",
    "type": "media",
    "type_tags": [
      "综合新闻媒体"
    ],
    "task_tags": [
      "fast_alert",
      "verification"
    ],
    "coverage_topics": [
      "world",
      "geopolitics"
    ],
    "region": "global",
    "language": "multi",
    "reliability_score": 0.75,
    "signal_to_noise": 0.68,